Company,Date,News,Intraday_Label,PrevClose_Label,Intraday_Change(%)
SUNPHARMA,2025-05-19,"The USFDA has granted Premarket Approval (PMA) for the next generation of the BLU-U Blue Light Photodynamic Therapy (PDT) Illuminator, which features LED (light-emitting diode) panels replacing the previous model’s fluorescent tubes. The new model (LED BLU-U), in combination with Levulan Kerastick (aminolevulinic acid HCl) topical solution, 20%, is indicated for the treatment of minimally to moderately thick actinic keratoses (AK) of the face, scalp, or upper extremities.",Negative,Positive,-0.848
NBCC,2025-05-19,"The company has sold 446 residential units at Aspire Silicon City, Phase IV, Noida, through an e-auction at a total sale value of Rs 1,467.93 crore. NBCC will earn a marketing fee of 1% of the sale value.",Positive,Positive,3.141
JSWSTEEL,2025-05-19,The Board of Directors will meet on May 23 to consider the raising of long-term funds and to discuss the recommendation of dividend payment.,Negative,Positive,-1.383
BAJAJ-AUTO,2025-05-19,"The company’s subsidiary Bajaj Auto International Holdings BV (BAIH BV) has entered into loan agreements with JP Morgan Chase Bank N.A., DBS Bank, and Citigroup Global Markets Asia to avail loans of 566 million euros (Rs 5,431.08 crore). It is an unsecured loan with a term of one year.",Positive,Positive,4.129
PNCINFRA,2025-05-19,"The Arbitral Tribunal has announced an arbitration award worth Rs 485.28 crore, along with 12% annual interest, in favour of PNC Infratech. This pertains to an EPC project for the construction of balance work of the new four-lane Agra Bypass in Uttar Pradesh, under the National Highways Authority of India (NHAI).",Positive,Positive,2.604
GLAXO,2025-05-19,"The company has reported a fire incident at one of its contract manufacturing facilities, resulting in temporary production disruption. The company is currently assessing the impact and is working closely with the site to expedite resumption of operations.",Negative,Positive,-1.239
IDEA,2025-05-19,"The company has acquired a 26% stake in Sangli Wind Energy for Rs 31.2 lakh. Sangli Wind Energy is a special purpose vehicle (SPV) created to own and operate a captive power plant. Post-acquisition, Sangli Wind Energy has become an associate of Vodafone Idea.",Negative,Negative,-6.537
BHARTIARTL,2025-05-19,"Promoter entity Pastel sold a 1.16% stake (7.1 crore shares) in the company at an average price of Rs 1,814.08 per share, amounting to a total value of Rs 12,880 crore.",Negative,Positive,-0.203
DAMCAPITAL,2025-05-19,Gazania Advisory LLP purchased 5.5 lakh shares in the company at an average price of Rs 216.70 per share.,Positive,Positive,2.01
INDUSINDBK,2025-05-19,Route One Fund I LP sold 50.38 lakh shares in the bank at an average price of Rs 765.68 per share.,Positive,Neutral,0.532
JSWINFRA,2025-05-19,"Promoter entity Sajjan Jindal Family Trust sold a 2% stake in the company at an average price of Rs 288.21 per share, valued at Rs 1,210.48 crore. However, the Government of Singapore acquired a 0.87% stake at an average price of Rs 288.10 per share.",Positive,Positive,0.258
PFIZER,2025-07-03,"Shilpi Singh has resigned from the position of Director – People Experience, effective August 14. However, the Board has appointed Reshma Parida as Senior Director – People Experience of the company, effective August 1. Currently, Reshma Parida serves as Senior Director – People Experience for APAC, AfME, and SBO APAC Cluster of the company.",Positive,Positive,0.925
AUROPHARMA,2025-07-03,"The company’s subsidiary, CuraTeQ Biologics s.r.o., has obtained marketing authorization from the European Commission for Dazublys, its trastuzumab biosimilar version. Dazublys is used in the treatment of adult patients with HER2-positive breast and gastric cancers. Additionally, Pharmacin BV has merged with its holding company, Agile Pharma BV, effective July 1. Both are wholly owned step-down subsidiaries of the company and are incorporated in the Netherlands.",Negative,Positive,-0.679
IOB,2025-07-03,"Shareholders have approved raising equity share capital of up to Rs 4,000 crore through QIP, FPO, rights issue, or ESPS during FY26.",Neutral,Positive,0.025
PNBHOUSING,2025-07-03,"The Board has recommended to the shareholders, for approval at the ensuing Annual General Meeting, the issuance of non-convertible debentures (NCDs) amounting to Rs 10,000 crore on a private placement basis, in one or more tranches.",Negative,Positive,-0.514
VOLTAS,2025-07-03,"The company has received a Show Cause Notice from the Central GST Commissionerate, Dehradun, alleging short payment of GST for the financial years 2018–19 to 2020–21 by Universal Comfort Products (which was merged with the company during FY21). The Show Cause Notice seeks an explanation as to why the tax amount of Rs 265.25 crore should not be demanded, along with interest and penalty.",Positive,Positive,2.244
MOTILALOFS,2025-07-03,"Motilal Oswal Asset Management Company has achieved a significant milestone, with its Assets Under Management (AUM) crossing Rs 1.5 lakh crore.",Positive,Positive,8.261
RVNL,2025-07-03,"Chandan Kumar Verma has been appointed as Chief Financial Officer (CFO) of the company, effective July 2. Currently, he serves as Executive Director – Finance at the company.",Negative,Positive,-0.825
NESTLEIND,2025-07-03,The FMCG company has added a new Maggi Noodles production line at its Sanand factory in Gujarat. This new line was developed with an investment of Rs 105 crore.,Negative,Positive,-0.479
YESBANK,2025-07-03,"Pankaj Sharma has resigned from the position of Chief Strategy and Transformation Officer of the bank, effective July 2, to pursue opportunities outside the organization.",Negative,Neutral,-0.739
MFSL,2025-07-03,"Axis Max Life Insurance, a material subsidiary of the company, has received a communication from an anonymous sender claiming unauthorized access to certain customer data. As an immediate measure, Axis Max Life has initiated an information security assessment and data log analysis. A detailed investigation is underway, in consultation with information security experts, to assess the root cause of the incident and take remedial action as necessary.",Negative,Negative,-1.287
RAYMONDREL,2025-07-03,"Negen Capital Services has purchased 3.88 lakh shares (0.58% stake) at a price of Rs 921.12 per share, valued at Rs 35.8 crore.",Negative,Negative,-3.077
IGCL,2025-07-03,SME Listing on July 3,Negative,,
POWERMECH,2025-07-15,"The company has secured an order worth Rs 498.39 crore from SJVN Thermal (P) for commissioning support and a comprehensive operation and maintenance (O&M) contract for the coal-based supercritical Buxar Thermal Power Project (BTPP) (2 x 660 MW) located in Buxar, Bihar. It has also received another order worth Rs 52.96 crore from Jhabua Power (a joint venture of NTPC) for O&M of boiler, turbine, and generator of a 1 x 600 MW unit at Seoni, Madhya Pradesh.",Negative,Positive,-2.353
RAILTEL,2025-07-15,"RailTel has received a work order worth Rs 264.07 crore from East Central Railway. The order involves the provision of Kavach, an indigenous train collision avoidance system, on low-density railway tracks of East Central Railway.",Positive,Positive,0.506
SUNPHARMA,2025-07-15,"The company has entered into a settlement and license agreement with Incyte Corporation related to litigation concerning LEQSELVI (deuruxolitinib). As a result, Sun Pharma has announced the launch of LEQSELVI in the United States. The drug is indicated for the treatment of adults with severe alopecia areata.",Positive,Positive,1.32
LICI,2025-07-15,"The Government of India has appointed R Doraiswamy as the Chief Executive Officer and Managing Director of LIC for a three-year term, effective July 14.",Positive,Neutral,0.96
OBEROIRLTY,2025-07-15,"The resolution plan of the consortium comprising Oberoi Realty, Shree Naman Developers, and JM Financial Properties and Holdings, under the Corporate Insolvency Resolution Process (CIRP) of Hotel Horizon, has been approved by the Committee of Creditors. The consortium will acquire Hotel Horizon for Rs 919 crore. The hotel holds 7,500 square meters of land at Juhu, Mumbai.",Negative,Positive,-0.268
PARSVNATH,2025-07-15,Leading Light Fund VCC – The Triumph Fund has sold 68.2 lakh shares at Rs 23.17 per share.,Positive,Positive,3.365
ANUHPHR,2025-07-15,Stock Trades Ex-Date for Income Distribution (InvIT),Positive,Positive,1.067
VEDL,2025-04-22,"Promoter entity Twin Star Holdings (borrower) has signed a Facility Agreement for $530 million with lenders. Vedanta Resources and Welter Trading are guarantors to the agreement. The Facility Agreement has been entered into for the purpose of servicing the financial indebtedness of the VRL Group, covering transaction expenses contemplated under the finance documents and for general corporate purposes of the borrower. Twin Star Holdings is a related party of Vedanta and is classified as a member of the promoter group, holding 40.02% of shares in Vedanta.",Negative,Positive,-0.229
TATAPOWER,2025-04-22,"The company’s renewable energy subsidiary, Tata Power Renewable Energy (TPREL), has signed a Power Purchase Agreement (PPA) to co-develop a 131 MW wind-solar hybrid renewable energy project.",Negative,Positive,-1.12
HINDUNILVR,2025-04-22,"The company has completed the acquisition of 90.5% shareholding in Uprising through a combination of primary infusion and secondary acquisition for a total cash consideration of Rs 2,706.4 crore.",Positive,Positive,1.211
HGINFRA,2025-04-22,HG Infra has been declared a qualified bidder by Gujarat Urja Vikas Nigam for 300 MW/600 MWh (out of the total project capacity of 500 MW/1000 MWh) for the setting up of standalone battery energy storage systems in Gujarat.,Negative,Positive,-2.689
GANDHAR,2025-04-22,"The company has signed a non-binding Memorandum of Understanding (MoU) with the Jawaharlal Nehru Port Authority (JNPA) to participate at Vadhvan Port for the development of a terminal for handling containers, bulk, and liquid cargo and to create supporting infrastructure. The estimated investment for the project is approximately Rs 1,000 crore, with operations expected to commence in 2030.",Positive,Positive,1.783
NURECA,2025-04-22,"The company has received formal approval from the Government of Punjab, Department of Industries & Commerce (Invest Punjab), for the establishment of a new manufacturing facility in Sundra, SAS Nagar, Punjab. The unit will focus on the manufacturing of health and wellness equipment.",Negative,Positive,-1.338
COALINDIA,2025-04-22,The company has signed a non-binding Memorandum of Understanding (MoU) with Damodar Valley Corporation (DVC) to set up a 2×800 MW coal-fired ultra supercritical power plant in Jharkhand. DVC is a power generator operating in West Bengal and Jharkhand.,Negative,Positive,-1.214
BRIGADE,2025-04-22,"The company has signed a Joint Development Agreement for a plotted development project in Malur, East Bengaluru, spanning approximately 20 acres. The gross development value of the project is around Rs 175 crore, with a total development potential of 0.45 million square feet.",Positive,Positive,1.487
GUJALKALI,2025-04-22,"The company has dispatched its first consignment of Benzyl Chloride from its new plant at Dahej. The company has established a 30,000 TPA Chlorotoluene plant at Dahej with an estimated project cost of Rs 350 crore.",Positive,Positive,1.191
MAZDOCK,2025-04-22,"Capt (IN Retd) Jagmohan has been appointed as Chairman & Managing Director on the Board of the company, effective April 21 until his superannuation on September 30, 2029. As a result, Biju George, Director (Shipbuilding), ceased to hold the additional charge of Chairman & Managing Director, effective April 21.",Negative,Positive,-0.885
IDFCFIRSTB,2025-07-21,"Currant Sea Investments B.V., an affiliate of global private equity major Warburg Pincus, has received RBI approval for its proposed investment of up to 9.99% in IDFC First Bank.",Positive,Neutral,1.356
SONACOMS,2025-07-21,"Sona Comstar has signed a binding term sheet with China-based Jinnaite Machinery Co. to establish a joint venture (JV) company in China. The JV will manufacture and supply driveline systems and components to automotive OEMs in China and globally. Sona Comstar will invest $12 million, while Jinnaite Machinery will contribute $8 million in the first phase of the joint venture.",Positive,Positive,0.577
IRCON,2025-07-21,"IRCON has received a Letter of Award for a project worth Rs 755.8 crore from Rail Vikas Nigam. The company participated in the project through a JV with JPWIPL in a 70:30 ratio. Additionally, IRCON received a Letter of Acceptance for two work orders from MMRDA for the Mumbai Metro Rail Project.",Negative,Positive,-0.63
TVSSCS,2025-07-21,"The company's subsidiary, TVS Logistics Investment UK (TVS LIUK), has acquired an additional 30% equity stake in its subsidiary TVS Autoserv GmbH. As a result, TVS LIUK now holds an 81% stake in TVS Autoserv GmbH.",Negative,Positive,-1.503
GODREJPROP,2025-07-21,"The company has appointed Amitesh Shah as the Zonal CEO – MMR, effective July 19, replacing Priyansh Kapoor, who resigned effective July 18. Additionally, Sandeep Navlakhe has been appointed as Chief Operating Officer, effective August 1, replacing Vikas Singhal, who resigned effective July 31.",Positive,Positive,1.366
FSL,2025-07-21,"The RP-Sanjiv Goenka Group company has signed an agreement to acquire Pastdue Credit Solutions, a UK-headquartered debt-collection business serving many of the UK’s market-leading companies. The acquisition is subject to approval by the Financial Conduct Authority (FCA).",Negative,Neutral,-0.241
AWL,2025-07-21,"Adani Commodities LLP has exited AWL Agri Business by selling its entire 13.54 crore shares worth Rs 3,732.5 crore to several domestic and global institutional investors. These include Duro India Opportunities Fund, IDFC Mutual Fund, Bandhan MF, Jupiter India Fund, Morgan Stanley, Quant MF, Shajaeatan Investment FZCO, and Vanguard Funds, at a price of Rs 275.5 per share.",Positive,Neutral,1.4
ANTHEM,2025-07-21,SME Listing on July 21,Positive,,
WANBURY,2025-05-20,"The Patalganga manufacturing site of the company has received the CBPF (GMP) certificate from the office of ANVISA (Brazil FDA). Earlier, on May 12, the company had received approval and a certificate from ANVISA, Brazil for its Tanuku site in Andhra Pradesh.",Negative,Positive,-5.577
HFCL,2025-05-20,The company has received a purchase order worth Rs 173.72 crore for the supply of indigenously manufactured telecom networking equipment for the 5G network of a leading domestic telecom service provider.,Negative,Positive,-4.928
RVNL,2025-05-20,"The company has emerged as the lowest bidder for a project worth Rs 178.64 crore from IRCON International. The project involves the supply of signalling, telecommunications, and EIMWB materials, along with installation, testing, and commissioning of distributed/centralised electronic interlocking (EI) installations at 10 new stations.",Negative,Positive,-5.67
SHYAMMETL,2025-05-20,"The company has announced its strategic entry into the wagon manufacturing segment with a greenfield facility at Kharagpur, West Bengal. The facility, developed under its step-down subsidiary, Ramsarup Industries, is scheduled to commence operations by March 2026.",Negative,Positive,-0.421
MASTEK,2025-05-20,"The Board has approved the appointment of Raghavendra Jha as Chief Financial Officer of the company, effective May 19.",Positive,Neutral,0.301
HCLTECH,2025-05-20,The company has appointed Kiran Cherukuri as Global GCC Practice Leader.,Negative,Positive,-1.355
BANDHANBNK,2025-05-20,"Navin Sharma has joined the bank as its Chief Audit Executive / Head of Internal Audit, effective May 19.",Negative,Positive,-3.567
MINDACORP,2025-05-20,"The Board has approved the appointment of Ajay Agarwal as President – Finance & Strategy of the company, effective May 19.",Negative,Neutral,-3.205
BBL,2025-05-20,"Mahindra Manulife Mutual Fund sold 1 lakh shares in the company at an average price of Rs 3,089.64 per share.",Negative,Positive,-2.512
MANORG,2025-05-20,"Niveshaay Hedgehogs Fund bought 50,426 equity shares in the company at an average price of Rs 574.91 per share.",Neutral,Positive,0.0
TCS,2025-09-03,"The IT services, consulting, and business solutions provider has expanded its strategic partnership with Tryg, a leading Scandinavian non-life insurance company operating in Denmark, Sweden, and Norway. As part of the seven-year, €550 million agreement, TCS will partner with Tryg to simplify and standardise operations across its three major markets and drive technological transformation.",Negative,Positive,-1.035
INDUSTOWER,2025-09-03,"The Board has approved the company’s foray into African markets, beginning with Nigeria, Uganda, and Zambia. These markets offer attractive prospects for revenue diversification, operational scalability, and long-term value creation. As part of its broader growth strategy, the company will continue to evaluate expansion opportunities in other African markets where Airtel has an established presence.",Negative,Negative,-0.231
WAAREEENER,2025-09-03,"The Board has approved the company's acquisition of a 64% stake in Kotson’s for Rs 192 crore. Following the acquisition, Kotson’s will become a subsidiary of the company. The Board also approved the acquisition of 100% shareholding of the company’s step-down subsidiary Impactgrid Renewables from its wholly owned subsidiary, Waaree Forever Energies.",Negative,Positive,-0.309
PNCINFRA,2025-09-03,"The company has emerged as the lowest bidder for the development of Lal Bahadur Shastri International Airport, Varanasi. The project includes the extension of the runway along with re-carpeting, strengthening of the existing runway, and allied works, with a quoted amount of Rs 297.01 crore.",Negative,Positive,-2.332
ADANIPOWER,2025-09-03,"The company has received approval from the Ministry of Coal to commence operations at the Dhirauli mine in Singrauli, Madhya Pradesh. According to the geological report, the block has a gross geological reserve of 620 MMT and a net geological reserve of 558 MMT.",Negative,Positive,-0.278
YESBANK,2025-09-03,"The Competition Commission of India (CCI) has approved the acquisition of stake by Sumitomo Mitsui Banking Corporation (SMBC) in Yes Bank from State Bank of India, Axis Bank, Bandhan Bank, Federal Bank, HDFC Bank, ICICI Bank, IDFC First Bank, and Kotak Mahindra Bank. SMBC had earlier received approval from the RBI to acquire a 24.99% stake in Yes Bank.",Positive,Positive,3.09
E2E,2025-09-03,"The company has received a letter from the Ministry of Electronics and Information Technology, Government of India, regarding the allocation of H200 SXM and H100 SXM GPUs for a period of 360 days, totalling 1,29,94,560 GPU hours to GNANI AI, for building India’s foundational AI model. The total value of this order is approximately Rs 177 crore.",Positive,Positive,3.663
DCMSHRIRAM,2025-09-03,"DCM Shriram has announced a long-term strategic agreement with Aarti Industries for the supply of chlorine. Under this arrangement, DCM Shriram Chemicals will be the exclusive supplier of chlorine from its chlor-alkali plant to Aarti Industries' upcoming downstream chemicals facility at Zone IV, Jhagadia, Gujarat.",Negative,Positive,-1.571
UPL,2025-09-03,"Advanta Mauritius, a subsidiary of Advanta Enterprises, has approved the purchase of the post-harvest business housed under Decco Holdings UK, the wholly owned subsidiary of UPL Corporation, Mauritius, at an enterprise valuation of $502 million. UPL Corporation Mauritius is a wholly owned subsidiary of UPL. This is a related party transaction and is subject to shareholder approval. Post-transaction, the Decco business will be consolidated with the Advanta seed business.",Negative,Positive,-0.334
LEMONTREE,2025-09-03,"The company has announced the signing of three new hotel properties - Lemon Tree Premier, Pushkar, Lemon Tree Premier, Ajmer, and Keys Lite by Lemon Tree Hotels, Ajmer. These properties will be managed by its subsidiary, Carnation Hotels.",Positive,Positive,2.229
DCXINDIA,2025-09-03,"The Board has approved the appointment of CA Prasanna Kumar T S as Chief Financial Officer, effective September 2. It has also approved the re-appointment of Raghavendra Rao Hosakote Shamarao as Chairman & Managing Director of the company.",Positive,Positive,0.985
ADANIENSOL,2025-09-03,"The company’s subsidiary, Adani Electricity Mumbai Ltd (AEML), has repurchased and cancelled $44.661 million of its $300 million 3.867% Senior Secured Notes due 2031. The buyback, funded through internal cash flows, has reduced the outstanding principal to $255.339 million.",Negative,Positive,-0.676
MOIL,2025-09-03,"The company reported its highest-ever August production of 1.45 lakh tonnes in August 2025, registering a 17% YoY growth. It also delivered 1.13 lakh tonnes of sales, a remarkable 25.6% YoY growth.",Negative,Positive,-3.203
TBOTEK,2025-09-03,"The Gurugram-based company has announced an agreement to acquire US-based Classic Vacations from Phoenix-based investment firm, The Najafi Companies, for $125 million, expanding its global presence into North America.",Positive,Positive,1.987
HCG,2025-09-03,"Ruby Ritolia has resigned as Chief Financial Officer of the company, effective September 2.",Positive,Neutral,3.689
HILINFRA,2025-09-03,The company has received the Letter of Acceptance (LOA) from the National Highways Authority of India for the operation of Muzaina Hetim Fee Plaza in Uttar Pradesh. The contract is valued at Rs 69.8 crore.,Negative,Positive,-1.178
SUNTECK,2025-09-03,The Board will meet on September 5 to consider the issue of securities of the company on a preferential basis for raising additional capital up to Rs 500 crore.,Positive,Positive,1.835
BAJAJHIND,2025-09-03,"BHL Securities Trust sold 1.58 crore shares (1.23%) in the sugar company at Rs 21.83 per share, valued at Rs 34.49 crore. Jayakumar Narayanswami, Nirad D Mehta, and Pankaj I Jain, as trustees of BHL Securities Trust, held a 2.43% stake in Bajaj Hindusthan Sugar as of June 2025.",Positive,Positive,0.843
LAXMIINDIA,2025-09-03,"BofA Securities Europe SA sold 4,10,023 shares in Laxmi India Finance, a non-banking finance company, at Rs 140 per share.",Positive,Positive,11.51
UCOBANK,2025-03-28,"The bank closed its Qualified Institutions Placement on March 27 and raised Rs 2,000 crore by allotting 58.36 crore equity shares to eligible qualified institutional buyers at the issue price of Rs 34.27 per share.",Negative,Positive,-3.514
ZAGGLE,2025-03-28,The Board has approved the acquisition of a 45.33% stake in Effiasoft from existing shareholders Koushik Shee and Akula Krishna Rao for Rs 36.72 crore. The Board also considered the proposal for the acquisition of an additional 5.67% stake in Effiasoft from Koushik Shee and Akula Krishna Rao for Rs 4.59 crore.,Positive,Positive,3.245
SANDHAR,2025-03-28,"The company has executed a Share Purchase Agreement with South Korea-based Jinyoung Electro-Mechanics Co. for the sale of its entire stake in the joint venture, Jinyoung Sandhar Mechatronics (JSM). The decision to exit the joint venture aligns with the company’s strategic objective of streamlining its business operations and concentrating on its core competencies.",Negative,Positive,-0.859
ADANIGREEN,2025-03-28,"The company, through its various wholly owned stepdown subsidiaries, has operationalized 396.7 MW power projects at Khavda, Gujarat. With the commissioning of this plant, its total operational renewable generation capacity has increased to 13,487.8 MW.",Negative,Positive,-1.984
PEL,2025-03-28,"The Board approved the issuance of non-convertible debentures up to Rs 100 crore (base issue size), along with a green shoe option to retain oversubscription of up to Rs 200 crore, aggregating the total issue size to Rs 300 crore, on a private placement basis.",Negative,Positive,-1.205
BEL,2025-03-28,"The company has secured additional orders worth Rs 1,385 crore since March 12. With these, it has now accumulated orders totaling Rs 18,415 crore in the current financial year.",Negative,Positive,-0.882
ULTRACEMCO,2025-03-28,"The cement major has commissioned a brownfield clinker capacity of 3.35 mtpa at its unit in Maihar, Madhya Pradesh. The second grinding mill is expected to be commissioned in Q1FY26. Further, it commissioned a brownfield expansion of the grinding unit at Dhule, Maharashtra, with a capacity of 1.2 mtpa, and a grinding unit of 0.60 mtpa at Durgapur, West Bengal. The company has set up a new bulk terminal in Lucknow with a capacity of handling 1.8 mtpa of cement. With this, the company’s total domestic grey cement manufacturing capacity stands at 183.36 mtpa. Along with its overseas capacity of 5.4 mtpa, the company’s global capacity stands at 188.76 mtpa.",Negative,Neutral,-0.656
RAYMOND,2025-03-28,"The National Company Law Tribunal, Mumbai (NCLT), has approved the Scheme of Arrangement between Raymond and Raymond Realty and their respective shareholders.",Negative,Positive,-3.241
SBILIFE,2025-03-28,The company has received an order from the Income Tax Department demanding a tax penalty of Rs 59.31 crore for the Assessment Year 2019-20.,Neutral,Neutral,0.191
JIOFIN,2025-03-28,"The company has subscribed to 8.5 crore equity shares of Jio Payments Bank for Rs 85 crore. This investment is made to fund the business operations of Jio Payments Bank. Post this investment, the company’s holding in Jio Payments Bank will increase from 82.17% to 85.04%. Additionally, the company has acquired 1.73 crore equity shares of its subsidiary Jio Finance for Rs 1,000.24 crore. Jio Finance will utilize the proceeds to fund its business operations.",Neutral,Positive,0.145
