Company,Date,News,Intraday_Label,PrevClose_Label,Intraday_Change(%)
LUPIN,2025-05-09,"The global pharma major has received approval from the United States Food and Drug Administration (US FDA) for its Abbreviated New Drug Application for Raltegravir tablets USP, 600 mg. Raltegravir tablets are bioequivalent to Isentress HD tablets from Merck Sharp & Dohme LLC. Lupin is the exclusive first-to-file for this product and is eligible for 180 days of generic drug exclusivity. Raltegravir tablets are indicated, in combination with other antiretroviral agents, for the treatment of human immunodeficiency virus (HIV-1) infection.",Positive,Negative,3.05
BPCL,2025-05-09,The company has awarded contracts for the development of 100 MW windfarm projects—50 MW each in Madhya Pradesh and Maharashtra. The Letter of Award (LOA) has been issued to Suzlon Energy for the 50 MW wind project in Madhya Pradesh and to Integrum Energy Infrastructure for the 50 MW project in Maharashtra. These projects are expected to be completed and commissioned within two years.,Positive,Negative,1.421
M&MFIN,2025-05-09,"The Board has approved a rights issue of 15.44 crore shares worth Rs 2,996.16 crore and fixed the issue price at Rs 194 per share. Eligible shareholders are entitled to one rights equity share for every eight shares held.",Negative,Negative,-3.018
BRIGADE,2025-05-09,"Brigade Group has acquired an 11-acre land parcel in Whitefield, Bengaluru. The land will be developed into a premium commercial project with a gross leasable area of approximately 1.5 million square feet and a gross development value of over Rs 2,000 crore.",Positive,Negative,2.161
CEATLTD,2025-09-02,"The company has acquired Michelin Group’s CAMSO construction compact line business, including their Sri Lanka-based Midigama plant and casting product plant in Kotugoda. It announced a $171 million investment in Sri Lanka.",Positive,Positive,4.854
ABCAPITAL,2025-09-02,"The Board has approved the appointment of Vishakha Mulye as Managing Director and Chief Executive Officer of the company for a period of five years, and Rakesh Singh as an Executive Director and Chief Executive Officer (NBFC) of the company for a period up to July 22, 2027, subject to the approval of the shareholders.",Negative,Positive,-2.535
IGL,2025-09-02,The company has entered into a Joint Venture Agreement with Rajasthan Rajya Vidyut Utpadan Nigam (RVUNL) for setting up a solar power project.,Positive,Positive,1.698
BEL,2025-09-02,"The company has secured additional orders worth Rs 644 crore since July 30. Major orders received include data centre, ship fire control system, tank navigation system, communication equipment, seekers, jammers, simulators, and electronic voting machines.",Neutral,Positive,-0.186
PURVA,2025-09-02,"The real estate developer acquired redevelopment rights for a prime residential society in Malabar Hill, Mumbai, through its wholly owned subsidiary, Purva Blue Agate. This 1.43-acre project offers a development potential of 0.7 million square feet, with an estimated revenue potential of Rs 2,700 crore.",Negative,Positive,-4.77
SYRMA,2025-09-02,"The electronics systems design and manufacturing company has signed a Joint Venture Agreement with Elemaster S.p.A Tecnologie Elettroniche, a global electronics design and manufacturing leader headquartered in Italy.",Negative,Positive,-1.131
FORTIS,2025-09-02,"The company's subsidiary, International Hospital (IHL), has entered into a 15-year lease agreement with RR Lifesciences for a 200-bed fully operational multi-specialty hospital in Greater Noida.",Negative,Positive,-0.455
AXISCADES,2025-09-02,"The company announced two new wins in aircraft cabin interiors design, development, and retrofit solutions. The pilot orders, valued at $1.2 million, have been awarded by two global leaders – a global aerospace OEM and a world-renowned aircraft cabin interior company in Europe and the USA.",Positive,Positive,1.418
UPL,2025-09-02,"The company's subsidiary, UPL Global, United Kingdom, has entered into a Share Subscription Agreement for the acquisition of a 49% stake in Grow Chemical, based out of Thailand. The acquisition is expected to be completed by December 2025.",Negative,Positive,-2.857
UBL,2025-09-02,"The company has commenced production of its flagship brand, Kingfisher, at Ilios Brewery, Andhra Pradesh. Ilios Brewery has a monthly capacity of up to 4.5 lakh cases of beer.",Positive,Positive,1.933
SBIN,2025-09-02,Indian Railways signed a Memorandum of Understanding (MoU) with the State Bank of India to provide significant insurance cover for its employees and their families. Employees who maintain salary accounts with SBI will get accidental death insurance of Rs 1 crore.,Negative,Neutral,-0.298
BLACKBUCK,2025-09-02,"GSAM Holdings LLC, an affiliate of Goldman Sachs, sold 49,09,874 equity shares (equivalent to a 2.74% stake) in Zinka Logistics Solutions, the operator of the digital trucking platform BlackBuck, at Rs 600.32 per share, valued at Rs 294.7 crore.",Negative,Positive,-3.805
MOBIKWIK,2025-09-02,"Abu Dhabi Investment Authority exited the digital wallet service provider by offloading its entire holding of 16,44,438 shares (a 2.1% stake) at Rs 238.45 per share, valued at Rs 39.21 crore.",Positive,Positive,16.958
CARBORUNIV,2025-09-02,"Sandhya G Parikh purchased 3 lakh shares in the Chennai-based Murugappa Group company—known for manufacturing coated and bonded abrasives, super refractories, and electrominerals—at Rs 915 per share, amounting to Rs 27.45 crore. The shares were acquired from promoter entity Murugappan Arunachalam Children Trust.",Positive,Neutral,0.691
KFINTECH,2025-05-08,"General Atlantic PE is likely to sell approximately 6% of the total shares outstanding in the company via block deals, reports CNBC-TV18, quoting sources.",Negative,Negative,-0.365
ASTRAL,2025-05-08,The company has completed the acquisition of a 100% equity stake in Al-Aziz Plastics.,Negative,Positive,-1.308
NAZARA,2025-05-08,"The National Company Law Tribunal (NCLT), Mumbai, has approved the company's resolution plan for the acquisition of Smaaash Entertainment.",Positive,Neutral,0.896
M&M,2025-05-08,"The company's production grew by 20.3%, reaching 85,925 units in April 2025, compared to 71,445 units in the same month the previous year. Sales for April increased by 17.7%, totaling 80,789 units, and exports surged by 82%, to 3,381 units compared to the corresponding month last year.",Negative,Positive,-3.015
RELIANCE,2025-05-08,"Reliance Jio added 21.74 lakh users in March 2025, compared to an addition of 17.65 lakh users in February.",Positive,Neutral,0.207
BHARTIARTL,2025-05-08,"The telecom operator added 12.50 lakh subscribers in March 2025, compared to an addition of 15.93 lakh users in February.",Negative,Neutral,-1.165
IDEA,2025-05-08,"The company lost 5.41 lakh users in March 2025, compared to a loss of 20,720 users in February.",Negative,Positive,-4.292
LODHA,2025-07-23,"An existing investor is likely to sell a 1% equity stake in the company via a block deal, reports CNBC-TV18, quoting sources. The total block size may amount to $165 million.",Negative,Negative,-4.714
OBEROIRLTY,2025-07-23,"An existing investor is likely to sell a 3% equity stake in the company via a block deal, reports CNBC-TV18, quoting sources. The total block size is expected to be $230 million.",Neutral,Negative,-0.023
INDGN,2025-07-23,"Neeraj Bharadwaj has resigned from the position of Non-Executive, Non-Independent Director of the company with immediate effect, following the exit of CA Dawn Investments.",Positive,Positive,1.003
HYUNDAI,2025-07-23,"The company has received an order from the Commissioner (Appeals), CGST Department, Tamil Nadu, demanding compensation cess of Rs 258.67 crore along with a penalty of Rs 258.67 crore, on the allegation of short payment of GST compensation cess on certain SUV models for the period September 2017 to March 2020. The company is reviewing the order and will exercise its right to file an appeal.",Neutral,Neutral,-0.047
DENTA,2025-07-23,"The company has bagged new orders to execute seven projects amounting to Rs 183 crore. With the addition of these new projects, the company's outstanding order book now stands at Rs 745.5 crore.",Negative,Positive,-1.935
VERANDA,2025-07-23,"The company has raised Rs 357.4 crore via the allotment of 1.58 crore shares to several qualified institutional buyers at Rs 225.2 per share. Trust Mutual Fund, Authum Investment and Infrastructure, Necta Bloom, Saint Capital Fund, and Resonance Opportunities Fund were among the investors in the qualified institutional placement that closed on July 22.",Negative,Positive,-1.153
360ONE,2025-07-23,"BC Asia Investments X sold 75 lakh shares at Rs 1,161.42 per share, and another 75 lakh shares at Rs 1,160.1 per share, which is a 3.71% stake, amounting to Rs 1,741.14 crore.",Negative,Negative,-1.316
POLYPLEX,2025-07-23,"First Water Fund has bought additional 0.6% stake at Rs 1,125 per share from Haresh Tikamdas Kaswani.",Negative,Positive,-0.563
MAHLOG,2025-07-23,Stock Trades Ex-Date for Buyback,Negative,Negative,-3.216
TANLA,2025-07-23,Stocks in F&O ban,Positive,Negative,2.045
NAVINFLUOR,2025-07-08,"The company launched its Qualified Institutional Placement (QIP) on July 7 to raise up to Rs 750 crore. The floor price has been fixed at Rs 4,798.28 per share.",Positive,Positive,2.316
REFEX,2025-07-08,The company has secured an order worth Rs 250 crore for comprehensive ash disposal along with operation and maintenance of fly ash systems from a prominent GENCO. The contract is for a tenure of three years.,Negative,Positive,-0.808
SPMLINFRA,2025-07-08,The company has received sanction for enhanced credit facilities amounting to Rs 205 crore to boost its project execution capabilities.,Negative,Positive,-0.609
JSWINFRA,2025-07-08,"The company has received a Letter of Award from the Syama Prasad Mookerjee Port Authority for the reconstruction of Berth 8 and mechanization of Berths 7 and 8 at Netaji Subhas Dock, Kolkata. The project comes with a 30-year concession period, and the estimated capital expenditure (capex) is Rs 740 crore.",Positive,Positive,0.532
ICICIBANK,2025-08-11,"The private sector lender has raised the average minimum balance for savings accounts in metros and urban areas to Rs 50,000 from the current Rs 10,000. This will be applicable to new accounts being opened from August 1. It has also raised the minimum balance requirement for savings accounts in semi-urban branches to Rs 25,000, from Rs 5,000 earlier, and in rural branches to Rs 10,000, up from Rs 2,500 earlier.",Positive,Negative,0.609
IDFCFIRSTB,2025-08-11,"Platinum Invictus B 2025 RSC has received approval from the Reserve Bank of India to invest up to 9.99% of the paid-up share capital of IDFC First Bank. Out of this, Platinum Invictus B 2025 RSC has proposed to invest Rs 2,624 crore (constituting a 5.09% stake) in the bank, as part of the preferential issue approved by the shareholders of the bank on May 17, 2025.",Positive,Neutral,0.825
BHARTIARTL,2025-08-11,"Promoter entity Indian Continent Investment offloaded 3 crore shares at Rs 1,870.4 per share and another 3 crore shares at Rs 1,871.95 per share in Bharti Airtel, totaling a 0.98 percent stake worth Rs 11,227.05 crore.",Negative,Positive,-0.301
BLACKBUCK,2025-08-11,"Sands Capital Private Growth II has sold 10.68 lakh shares (0.6% stake) in the company at Rs 520.47 per share, valued at Rs 55.58 crore. Sands Capital was holding a 3.68 percent stake in Zinka as of June 2025.",Positive,Positive,0.376
EPACK,2025-08-11,"Tata Mutual Fund has bought 15 lakh shares (1.56% stake) in EPACK Durable at Rs 390 per share, amounting to Rs 58.5 crore. However, Augusta Investments Zero Pte offloaded 38.5 lakh shares (4.01% stake) at Rs 391.02 per share, valued at Rs 150.5 crore. Augusta Investments was holding a 10.13% stake in EPACK as of June 2025.",Negative,Positive,-4.393
CENTUM,2025-08-11,"Promoter Mallavarapu Venkata Apparao sold 6.6 lakh shares (equivalent to a 4.5% stake) in Centum Electronics at Rs 2,300.93 per share, amounting to Rs 153.2 crore. Of this, HDFC Mutual Fund and 3P India Equity Fund acquired a 3.5% stake worth Rs 118.45 crore.",Negative,Positive,-0.932
BHARTIARTL,2025-08-08,"Promoter entity Indian Continent Investment is likely to sell a 0.8% equity stake in the company via a block deal, reports CNBC-TV18, quoting sources. The block size is expected to be around Rs 9,310 crore, and the floor price for the deal is likely set at Rs 1,862 per share.",Negative,Negative,-1.468
AUBANK,2025-08-08,AU Small Finance Bank has received in-principle approval from the Reserve Bank of India (RBI) for its transition from a small finance bank to a universal bank.,Negative,Positive,-7.625
ZYDUSLIFE,2025-08-08,The company has received a Notice of Compliance (NOC) from Health Canada for its ZDS-Varenicline tablets (0.5 mg and 1 mg). This marks the group’s first NOC approval in Canada. Varenicline is used as an aid for smoking cessation.,Negative,Positive,-1.437
PPLPHARMA,2025-08-08,"The company has informed exchanges about a fire incident at a third-party warehouse in Telangana, which also housed certain inventory belonging to the company, on August 6. The fire is largely under control, and the cause of the fire is under investigation. The value of inventory affected by the incident is currently estimated at Rs 45 crore.",Negative,Neutral,-0.933
ETERNAL,2025-08-08,"Alibaba-backed Antfin Singapore Holding Pte has sold 14.13 crore shares (1.46% stake) in Eternal, the parent firm of Zomato, at Rs 289.91 per share, amounting to a total transaction value of Rs 4,096.7 crore. Antfin had held a 1.95% stake in Eternal as of June 2025.",Neutral,Negative,0.183
KOTAKBANK,2025-08-08,"Oppenheimer Funds Inc, through its Oppenheimer Developing Markets Fund, has sold 1.03 crore shares (0.52% stake) in Kotak Mahindra Bank at a price of Rs 1,965.2 per share, totaling approximately Rs 2,035.4 crore.",Negative,Neutral,-2.066
BLACKBUCK,2025-08-08,"Ithan Creek Master Investors (Cayman) LPF has sold 9.9 lakh shares (0.55% stake) in Zinka Logistics Solutions at Rs 540.54 per share, valued at Rs 53.67 crore. As of June 2025, Ithan Creek held a 1.3% stake in Zinka.",Neutral,Positive,0.058
NESTLEIND,2025-08-08,Stock Trades Ex-Date for Income Distribution (InvIT),Negative,Positive,-2.273
BAJAJ-AUTO,2025-03-19,"The Board has re-appointed Rajivnayan Rahulkumar Bajaj as the Managing Director & Chief Executive Officer of the company for five consecutive years, effective April 1. Additionally, Abhinav Bindra has been appointed as a Non-executive Independent Director of the company for five years, effective May 20. The Board has also approved an additional fund infusion of up to Rs 1,500 crore in the company's subsidiary, Bajaj Auto Credit, in one or more tranches.",Positive,Positive,0.624
ZYDUSLIFE,2025-03-19,"The pharmaceutical company has received final approval from the United States Food and Drug Administration (USFDA) to manufacture Apalutamide tablets in a 60 mg strength. Apalutamide is an androgen receptor inhibitor used for the treatment of patients with metastatic castration-sensitive prostate cancer. Apalutamide tablets had annual sales of $1,099.8 million in the United States, according to IQVIA MAT January 2025.",Negative,Positive,-1.95
GRINFRA,2025-03-19,"The company has received a Letter of Acceptance from the National Highways Authority of India for a project worth Rs 4,262.78 crore. The project involves the construction of the Agra-Gwalior Greenfield road in Uttar Pradesh, Rajasthan, and Madhya Pradesh on a DBFOT pattern under the BOT (Toll) Mode, as part of the NH(O) scheme.",Positive,Positive,2.61
ESAFSFB,2025-03-19,The Board will meet on March 21 to consider fund raising through the issuance of non-convertible debentures (Tier II bonds) on a preferential basis.,Positive,Positive,1.332
GRANULES,2025-03-19,"The company's subsidiary, Granules Europe at Bath, United Kingdom, has been voluntarily dissolved, effective March 18, due to a strategic change in the business model.",Negative,Positive,-0.651
WESTLIFE,2025-03-19,"Akshay Jatia has been elevated to Chief Executive Officer (CEO) of the company, replacing Amit Jatia, who will cease to be a key managerial personnel, effective March 18. Amit Jatia and Akshay Jatia will continue as directors of the company, with no change in the composition of the Board of Directors. Akshay Jatia is currently the Executive Director (Whole Time Director) of the company.",Positive,Positive,2.338
STAR,2025-03-19,"As part of right-sizing the group entities and eliminating non-operating entities, the company's step-down subsidiary, Generic Partners UK, has been voluntarily dissolved, effective March 18. Generic Partners UK was a non-operating company, and its contribution to the consolidated turnover of the company for FY24 was nil.",Positive,Positive,0.992
TVSSCS,2025-03-19,"Andrew Jones has resigned as CEO, Europe of the company. He will be relieved of his duties, effective May 31.",Positive,Positive,2.992
LICI,2025-03-19,"LIC has issued a clarification note on media reports that the company is looking to enter the health insurance business. In this regard, LIC stated that it is still in advanced talks with a standalone health insurance company to acquire a substantial stake to broaden the Corporation's footprint in the health insurance market. However, no binding agreement has been entered into. The execution and consummation of the deal are subject to regulatory approvals, and there can be no guarantee or assurance of the execution/consummation of the potential deal.",Positive,Positive,1.882
TDPOWERSYS,2025-03-19,The company has received approvals from the BSE and National Stock Exchange India for the reclassification of Lavanya Sankaran from the promoter & promoter group to the public shareholder category.,Positive,Positive,3.389
BPCL,2025-03-19,"In a significant advancement in sustainable aviation, Bharat Petroleum Corporation (BPCL) has entered into a quadripartite Memorandum of Understanding (MoU) with BluJ Aerospace, the Agency for New and Renewable Energy Research and Technology (ANERT), the Government of Kerala, and Cochin International Airport (CIAL) to develop the first hydrogen-fueled Vertical Take-off and Landing (VTOL) aircraft ecosystem globally.",Positive,Positive,0.664
ZENTEC,2025-03-19,The company has completed the investment and acquired a 45.33% stake in Bhairav Robotics. Bhairav has now become an associate company of Zen Technologies.,Positive,Positive,0.269
UFLEX,2025-03-19,"The company's subsidiary, Flex Middle East, FZE, Dubai, has incorporated a step-down subsidiary, Flex Films AZB AFEZCO, in Azerbaijan. This new subsidiary will set up a facility for manufacturing biaxially oriented polypropylene (BOPP) packaging film in Azerbaijan and sell it in the domestic market as well as in other adjoining CIS and European countries.",Positive,Positive,1.805
JYOTISTRUC,2025-03-19,Sun-N-Sand Hotels bought a 0.58% stake in the company at an average price of Rs 17.09 per share.,Positive,Positive,3.779
TATATECH,2025-01-08,"The company has signed a strategic Memorandum of Understanding (MoU) with Telechips (an automotive semiconductor solutions company) to innovate solutions for next-gen software-defined vehicles (SDVs). The collaboration will focus on co-developing innovative solutions for Advanced Driver Assistance System (ADAS) platforms, Automotive Cockpit domain controllers, and Central & Zonal gateway controllers, helping OEMs address software-hardware integration challenges and reduce time-to-market.",Negative,Positive,-1.303
EXICOM,2025-01-08,The EV charging and critical power solutions manufacturer has signed a Memorandum of Understanding (MoU) with Mufin Green Infra for the expansion of EV charging infrastructure in India.,Positive,Positive,0.518
RVNL,2025-01-08,RVNL has signed an MoU with Dubai-based GBH International Contracting LLC (GBHIC). They will work together to explore business opportunities in the civil infrastructure sector in GCC countries.,Negative,Positive,-0.619
M&M,2025-01-08,"Mahindra announced the prices for the top-end variant of its electric-origin SUVs - BE 6 and XEV 9e. BE 6 Pack Three is priced at Rs 26.9 lakh, and XEV 9e Pack Three at Rs 30.5 lakh. Phased test drives will start on January 14, 2025, while bookings for BE 6 and XEV 9e will open simultaneously on February 14, 2025. Deliveries are expected to begin in early March 2025.",Negative,Positive,-1.56
MANKIND,2025-01-08,"The company has pledged the remaining 56.31% of its shares in its subsidiary, Bharat Serums & Vaccines, in favour of Catalyst Trusteeship as the Common Security Trustee for the benefit of the holders of the NCDs (non-convertible debentures).",Negative,Positive,-1.655
CESC,2025-01-08,"The company has issued a letter of award to its subsidiary Purvah Green Power for the project to set up a 150 MW wind-solar hybrid power project, with an additional 150 MW capacity under the Greenshoe option.",Negative,Negative,-2.28
BSOFT,2025-01-08,"Roopinder Singh has resigned as Chief Executive Officer - Americas due to personal reasons, effective February 7, 2025.",Neutral,Negative,-0.101
PURVA,2025-01-08,"The real estate developer has appointed Deepak Rastogi as the Group Chief Financial Officer (CFO), effective January 15, 2025.",Negative,Positive,-1.285
MARUTI,2025-01-08,"The passenger vehicle manufacturer announced its blueprint for electric mobility, christened ‘e for me’. This is a comprehensive ecosystem that integrates electric vehicles, pioneering technology, and robust charging infrastructure.",Positive,Neutral,0.819
ORISSAMINE,2025-01-08,"The company has suspended Ramakanta Behera, the Chief Financial Officer (CFO), with immediate effect due to allegations of misconduct. The allegations are of a serious nature.",Negative,Positive,-1.613
SBIN,2025-01-08,"Baldev Prakash has been given the responsibility as DMD & Group Chief Risk Officer, and Shiva Om Dikshit as DMD (Operations-Channel Management) of the bank.",Negative,Positive,-1.249
JINDWORLD,2025-01-08,"The Board has approved the issuance of 4 bonus equity shares for every 1 existing fully paid-up equity share of Rs 1 each held, to the eligible equity shareholders of the company as of the record date.",Negative,Positive,-2.763
OLAELEC,2025-01-08,"The company has received an administrative warning letter from SEBI for violating regulations. The warning letter pertains to the dissemination of information about plans for a four-fold expansion of the company-owned store network. SEBI observed that this information was first disseminated by promoter and Chairman-cum-Managing Director Bhavish Aggarwal on social media before disclosing it on the stock exchanges, thus breaching regulations that require listed entities to provide material information to stock exchanges and all investors in a timely manner. Additionally, the Karnataka High Court has granted a six-week extension for the company to submit its response regarding the additional documents and information sought by the Central Consumer Protection Authority (CCPA).",Positive,Negative,3.26
CAMLINFINE,2025-01-08,Stocks Trade Ex-Date for Split,Neutral,Negative,-0.133
UPL,2025-02-25,"The company said its step-down subsidiary, UPL Holdings Brazil BV, has made an additional investment of $53.85 million in Sinova Inovações Agrícolas S.A. Sinova is an associate entity of UPL Brazil. As a result, the shareholding of UPL Holdings Brazil BV in Sinova has increased from 38.96% to 49.97%.",Neutral,Positive,-0.093
WELCORP,2025-02-25,"The company has incorporated a wholly owned subsidiary, Welspun Europe S.A., in Spain, Europe.",Positive,Negative,0.309
SBILIFE,2025-02-25,"The Board has approved the appointment of Dorababu Daparti as Deputy Chief Executive Officer of the company, effective February 24.",Negative,Negative,-0.557
ONGC,2025-02-25,"The company will make an investment of Rs 1,200 crore in ONGC Green (OGL) via a rights offer. OGL will utilize the equity share capital proceeds from the rights offer for investments in acquiring a 100% equity stake in PTC Energy.",Negative,Positive,-0.851
NTPC,2025-02-25,"The company, along with its subsidiary NTPC Green Energy, has signed multiple MoUs with the Madhya Pradesh government to invest over Rs 2 lakh crore in Madhya Pradesh. The investments will include renewable projects based on solar, wind, pump hydro, and other carbon-neutral energy sources in the state.",Negative,Neutral,-0.437
SHREECEM,2025-02-25,"The cement company has received a GST demand order of Rs 41.1 crore from the Deputy Commissioner, State Tax, Special Circle, Patna (Bihar), regarding valuation and excess ITC availed.",Neutral,Neutral,-0.165
REFEX,2025-02-25,"The company's subsidiary, Venwind Refex Power (VRPL), has incorporated a new company, Venwind Refex Power Services (VRPSL), as its wholly owned subsidiary. With this, VRPSL has become a step-down subsidiary of Refex Industries Limited.",Negative,Negative,-1.131
NAZARA,2025-02-25,"The company has acquired an additional 6,51,204 equity shares (representing a 38.57% stake) in Funky Monkeys from its existing shareholders for Rs 28.7 crore. With this, the company now holds a 60% stake in Funky Monkeys, which has become a subsidiary of the company.",Neutral,Positive,-0.065
LICI,2025-02-25,"The Corporation has received a demand order of Rs 57.3 crore for GST, interest, and penalty for Delhi for FY2020-21, due to excess ITC availed.",Negative,Negative,-1.881
BIOCON,2025-02-25,"The company's subsidiary has launched the Yesintek biosimilar in the United States. This is one of the first Stelara biosimilar market entrants in the country. Yesintek is approved for the treatment of Crohn’s disease, ulcerative colitis, plaque psoriasis, and psoriatic arthritis.",Negative,Positive,-0.879
