Company,Date,News,Intraday_Label,PrevClose_Label,Intraday_Change(%)
NIACL,2024-12-20,"Lavanya Mundayur has been elevated to the position of Chairman and Managing Director (CMD) of Agriculture Insurance Company of India. At the time of elevation, Lavanya Mundayur was the General Manager of New India Assurance Company.",Positive,Neutral,4.084
AGSTRA,2024-12-20,"Promoter Vineha Enterprises sold 3.23% stake in AGS Transact at an average price of Rs 72.59 per share. However, Upadhyaya Ajay bought 0.61% stake at an average price of Rs 71.64 per share, and Yuyu Family Private Trust picked up 0.61% stake at an average price of Rs 71.66 per share.",Negative,Positive,-2.899
DOMS,2024-12-20,"Foreign promoter FILA - Fabbrica Italiana Lapis ED Affini SPA sold 2.29% stake in DOMS at an average price of Rs 2,879.12 per share, and 2.28% stake at an average price of Rs 2,879.47 per share, amounting to Rs 798.5 crore. However, Axis Asset Management Company bought 0.5% stake in DOMS at an average price of Rs 2,879 per share, valued at Rs 211.46 crore.",Negative,Neutral,-5.121
IKS,2024-12-20,"Norges Bank, on account of the Government Pension Fund Global, bought 1.98% stake in the company, valued at Rs 651.7 crore. Norges Bank purchased 16.59 lakh shares at an average price of Rs 1,923.92 per share, and 17.5 lakh shares at an average price of Rs 1,899.67 per share.",Negative,Positive,-9.986
MOBIKWIK,2024-12-20,"Investor Peak XV Partners Investment Holdings III sold 0.9% stake in Mobikwik at an average price of Rs 579.37 per share, valued at Rs 40.59 crore.",Negative,Negative,-8.624
DIAMONDYD,2024-12-20,"Stallion Asset bought 1.54% stake in the company at an average price of Rs 965.05 per share, amounting to Rs 35.64 crore. However, Bandhan Mutual Fund sold 1.65% stake at an average price of Rs 965.05 per share, valued at Rs 38.1 crore.",Positive,Positive,1.042
SAILIFE,2024-12-20,"Sivaramakrishnan Chittor, the Chief Financial Officer of the company, sold 0.72% stake in Sai Life at an average price of Rs 732 per share, valued at Rs 109.8 crore.",Negative,Negative,-3.438
MANORAMA,2024-12-20,"Ajay Jaisinghani bought 0.17% stake in Manorama from Invesco Mutual Fund at an average price of Rs 1,165 per share.",Negative,Negative,-1.466
BHARATSE,2024-12-20,Stocks Trade Ex-Date for Resolution Plan -Suspension,Positive,,
LINC,2024-12-20,F&O Ban,Negative,Positive,-5.431
KOTAKBANK,2025-02-13,"The Reserve Bank of India lifted restrictions on Kotak Mahindra Bank, allowing the lender to onboard new customers through its online and mobile banking channels, and issue fresh credit cards. The RBI had placed restrictions on Kotak Mahindra Bank on April 24, 2024.",Positive,Positive,0.499
RELIANCE,2025-02-13,"The company has incorporated a wholly owned subsidiary, REC Sustainable Energy Solutions Pte (REC SES) in Singapore, to set up a global capability centre for consolidating research and development (R&D) activities.",Neutral,Neutral,-0.078
ICICIBANK,2025-02-13,"Joint venture partner Prudential plc is evaluating a potential listing of ICICI Prudential Asset Management Company, involving the partial divestment of its shares, subject to market conditions, requisite approvals, and other considerations. After the completion of such a divestment, the net proceeds would be returned to shareholders. ICICI Bank intends to retain its majority shareholding in ICICI Prudential Asset Management Company.",Negative,Neutral,-0.291
TATAPOWER,2025-02-13,"The company's subsidiary, Tata Power Renewable Energy, has signed a non-binding Memorandum of Understanding (MoU) with Oil and Natural Gas Corporation (ONGC) to explore joint opportunities in the battery energy storage system (BESS) and its value chain.",Negative,Positive,-1.01
RITES,2025-02-13,The transport infrastructure consultancy organization signed a Memorandum of Understanding (MoU) with the Centre for Development of Advanced Computing (C-DAC) to collaborate on IT solutions for consultancy assignments.,Negative,Positive,-2.374
RAILTEL,2025-02-13,"The company has received work orders worth Rs 123.13 crore from the State Project Director (SPD) Bihar Education Project Council (BEPC), and an additional Rs 14.71 crore work order from Airports Authority of India Chennai.",Negative,Positive,-1.238
VAKRANGEE,2025-02-13,"The Reserve Bank of India (RBI) has extended the validity of authorization issued to Vakrangee to set up, own, and operate White Label ATMs in India, until March 31, 2026. Vakrangee currently has 6,035 White Label ATMs as of January 2025.",Positive,Negative,5.47
ADANIPORTS,2025-02-13,"The company's subsidiary, Adani Harbour Services, has incorporated a joint venture company, Al Annabi Marine Services, in Qatar. Adani has incorporated this joint venture with Sea Horizon Offshore Marine Services and Jamal A Rab A M Al Yafei.",Negative,Positive,-1.962
MEDIASSIST,2025-02-13,Aditya Birla Sun Life Mutual Fund bought a 1.56% stake in Medi Assist for Rs 54.22 crore.,Positive,Positive,2.102
DIAMONDYD,2025-02-13,"Bharat Value Fund bought a 2.56% stake in the company at an average price of Rs 1,147.48 per share, valued at Rs 70.12 crore. However, Malabar India Fund sold a 0.66% stake at an average price of Rs 1,150.01 per share, amounting to Rs 18.25 crore.",Negative,Neutral,-4.18
NIVABUPA,2025-06-02,"Reports from CNBC-TV18, quoting sources, indicate that Fettle Tone and Krishnan Ramchandra are likely to sell up to 7.2% of their stake in Niva Bupa Health Insurance Company through block deals. The expected block size for the transaction is around Rs 1,082 crore.",Negative,Negative,-1.645
APLLTD,2025-06-02,"The United States Food and Drug Administration (US FDA) has issued a Form 483 with four observations for Alembic Pharmaceuticals' API-I & II units at Panelav. The inspection took place between May 26 and May 31, 2025, and was a routine, unannounced cGMP inspection. None of the observations were related to data integrity.",Negative,Negative,-1.386
IRCON,2025-06-02,"The company has received an Engineering, Procurement, and Construction (EPC) order worth Rs 1,068.34 crore from East Central Railway. The order involves the construction of a new broad gauge (BG) rail bridge, including the sub-structure for a double-line track and the superstructure for a single-line track, across the river Ganga between Bikramshila and Katareah stations on the New Railway Line Project.",Positive,Positive,0.448
GODREJPROP,2025-06-02,"Godrej Properties, a leading real estate developer, has acquired a 14-acre land parcel in Kharadi-Wagholi, Pune. The company plans to develop a premium group housing project with a potential developable area of 3.7 million square feet, estimated to generate a revenue potential of Rs 4,200 crore.",Positive,Positive,1.409
CIPLA,2025-06-02,"The United States Food and Drug Administration (USFDA) conducted a current Good Manufacturing Practices (cGMP) inspection at the company’s manufacturing facility in Bommasandra, Bengaluru, during May 26–30, 2025, and issued one observation in Form 483. Meanwhile, the Board has approved the appointment of Prabhakarn Balakrishnan Nair as Senior Management Personnel and Global Chief Manufacturing Officer of the company, effective July 1.",Neutral,Neutral,0.15
MOIL,2025-06-02,"The company has reduced the prices of all chemical grades and manganese ore fines by 5–15%, effective June 2.",Negative,Neutral,-2.335
ZYDUSLIFE,2025-06-02,"The company has received tentative approval from the United States Food and Drug Administration (USFDA) for Rifaximin tablets. Rifaximin is used for the treatment of irritable bowel syndrome with diarrhea (IBS-D) in adults. As per IQVIA MAT March 2025 data, Rifaximin tablets recorded annual sales of $2,672.9 million in the United States.",Negative,Positive,-0.637
ADANIENSOL,2025-06-02,"The company has won a Rs 1,660 crore inter-state transmission project in Maharashtra. With this addition, its transmission order book now stands at Rs 61,600 crore. Meanwhile, the Board has approved fund raising of up to Rs 4,300 crore via Qualified Institutional Placement (QIP) or other modes.",Neutral,Positive,0.006
COALINDIA,2025-06-02,"The company has filed draft papers for the IPO of its subsidiary, Bharat Coking Coal, with SEBI, NSE, and BSE. The proposed IPO will comprise an offer for sale of up to 46.57 crore shares by Coal India.",Neutral,Positive,0.188
IEX,2025-06-02,"Dalmia Cement (Bharat) has sold a 0.57% stake in Indian Energy Exchange at an average price of Rs 200.71 per share. As of March 2025, Dalmia Cement held a 4.17% stake in the company.",Neutral,Neutral,0.065
INDIGOPNTS,2025-06-02,"Peak XV Partners Investments V and IV have exited Indigo Paints by selling their entire 3.18% shareholding at an average price of Rs 1,046.45 per share. Kotak Mahindra Mutual Fund was the buyer for the 3.18% stake.",Negative,Positive,-1.409
SENORES,2025-05-06,"The company, through its wholly-owned subsidiary Senores Pharmaceuticals Inc., USA, has signed an agreement to acquire the USFDA-approved Abbreviated New Drug Application (ANDA) for Topiramate HCl 25, 50, 100, and 200 mg tablets from Wockhardt. Topiramate is indicated for the treatment of epilepsy and migraine.",Negative,Positive,-2.941
GLENMARK,2025-05-06,Ichnos Glenmark Innovation (IGI) announced that the US Food and Drug Administration (FDA) has granted Fast Track designation for ISB 2001. This designation was granted for the treatment of adult patients with relapsed or refractory multiple myeloma (RRMM). ISB 2001 is an investigational trispecific antibody therapeutic that targets BCMA and CD38 on myeloma cells and CD3 on T cells. It is currently being evaluated in a Phase 1 dose-expansion study.,Negative,Positive,-2.639
IEX,2025-05-06,"The electricity exchange achieved a monthly electricity traded volume of 10,584 MU in April, marking a 26% year-on-year (YoY) increase. The Day-Ahead Market (DAM) achieved a volume of 4,231 MU, a 3% YoY growth, while the Real-Time Electricity Market (RTM) volume rose 48% YoY to 3,893 MU in April. The average DAM price during the month was Rs 5.20 per unit.",Negative,Positive,-4.025
PARAS,2025-05-06,The company has entered into a Memorandum of Understanding (MoU) with Israel-based HevenDrones to expand both parties’ businesses in the Indian and global defence sectors. The two companies intend to form a joint venture in India for the development and production of logistics and cargo drones for both defence and civil markets.,Negative,Positive,-2.946
IRCON,2025-05-06,The company has received a work order worth Rs 187.08 crore from Kerala State IT Infrastructure for the construction of a Dedicated Rural Industrial Park in Thiruvananthapuram.,Negative,Positive,-3.284
RATEGAIN,2025-05-06,The company announced the appointment of Deepak Kapoor as its new Chief Technology Officer (CTO) and Rohan Mittal as the new Chief Financial Officer (CFO).,Negative,Neutral,-1.846
CYIENT,2025-05-06,"The company's subsidiary Cyient Inc., based in the USA, has received an order levying a penalty of $26,779.74 towards Employer Shared Responsibility Payment (ESRP) from the US Department of the Treasury, Internal Revenue Service (IRS).",Negative,Neutral,-3.47
FORTIS,2025-05-06,"The company’s subsidiary, Fortis Hospitals, has received a rectification order under the Income Tax Act, whereby mistakes in a previous tax demand order were corrected, and the tax demand was reduced to Rs Nil. The original demand was Rs 89.53 crore for Assessment Year 2022–23, raised by the Income Tax Department.",Positive,Neutral,0.711
VERANDA,2025-05-06,"The Board has appointed Saurani Pathan Mohasin Khan as the new Chief Financial Officer (CFO), succeeding Saradha Govindarajan, who stepped down from the role to pursue personal interests and commitments.",Positive,Neutral,0.353
KESORAMIND,2025-05-06,"HDFC Life Insurance Company sold 20,35,305 equity shares of Kesoram at an average price of Rs 4 per share, and an additional 18.5 lakh shares at an average price of Rs 4.01 per share.",Neutral,Positive,0.0
ATHERENERG,2025-05-06,SME Listing on May 6,Negative,,
BAJAJFINSV,2025-06-06,"Promoter entities Bajaj Holdings and Jamnalal Sons are likely to sell up to a 1.94% stake in Bajaj Finserv via block deals, reports CNBC-TV18 quoting sources. The total block size may be around Rs 5,828 crore, with a floor price of Rs 1,880 per share.",Positive,Positive,1.118
ASHOKA,2025-06-06,"The company has received letters of intent worth Rs 1,387.2 crore from the Motor Vehicles Department, Maharashtra, for various circles (Nagpur, Mumbai, Pune, Marathwada, Konkan, and Western Maharashtra). The project involves the design, implementation, integration, operation, and maintenance of an intelligent traffic management system on various stretches in these circles for a period of 10 years.",Negative,Positive,-2.559
PRAJIND,2025-06-06,"Enersur S.A., a Paraguay-based renewable energy company, has selected Praj Industries for its next major project. Praj will support the development, assessment, and phased implementation of a biorefinery project in Paraguay.",Positive,Positive,2.161
JSWENERGY,2025-06-06,"The company has commissioned 281 MW of organic renewable energy capacity, comprising 215 MW of solar capacity and 66 MW of wind capacity, taking its total installed capacity to 12,499 MW. Further, JSW Renew Energy Three, a step-down subsidiary, has signed a Power Purchase Agreement (PPA) with Adani Electricity Mumbai for 250 MW of STU-connected wind capacity. The PPA, signed for a supply period of 25 years, is priced at a tariff of Rs 3.65/kWh. The project in Maharashtra is expected to be commissioned within the next 24 months.",Positive,Positive,1.722
COALINDIA,2025-06-06,Coal India (CIL) has executed a non-binding Memorandum of Understanding (MoU) with Indian Port Rail & Ropeway Corporation in Kolkata for the development of rail infrastructure for CIL and its subsidiaries.,Positive,Positive,0.276
IMAGICAA,2025-06-06,The company has executed a facility agreement worth Rs 275 crore with HDFC Bank to avail a loan for financing the purchase of the park business undertaking—Wet’n Joy (Amusement Park and Water Park) at Lonavala and Wet’n Joy (Water Park and Saiteerth Devotional Theme Park) at Shirdi—from Giriraj Enterprises.,Negative,Positive,-3.076
KCP,2025-06-06,"K Ramakrishna has been designated as the CEO of the cement business (head of the cement division) of the company, effective June 5. He currently serves as the Senior President of the cement division.",Negative,Positive,-0.71
NTPCGREEN,2025-06-06,"The company has commenced operations of the first part capacity of 110.25 MW out of the 1,255 MW Khavda-I Solar PV project of its subsidiary, NTPC Renewable Energy.",Negative,Positive,-0.73
LLOYDSENGG,2025-06-06,"The Board has approved the allotment of 30.85 crore partly paid-up equity shares at a price of Rs 32 per share to the company’s eligible equity shareholders on a rights basis. Of this amount, Rs 16 per share has been paid on allotment, and the remaining amount will be payable in not more than two calls.",Negative,Negative,-0.947
BLACKBUCK,2025-06-06,"The shareholding of Accel India IV (Mauritius) and Accel Growth Fund V LP in the company has been reduced by 2.73%, to 10.81% from 13.54%, following the completion of an open market transaction on June 3.",Positive,Neutral,1.149
ZAGGLE,2025-06-06,"The company has agreed to acquire a 100% stake in Greenedge Enterprises from the existing shareholders for Rs 27 crore. It has executed a non-binding term sheet for the said acquisition. The acquisition of Greenedge is expected to strengthen Zaggle’s offerings in the loyalty and rewards segment, as well as the travel segment.",Negative,Positive,-3.092
MPHASIS,2025-06-06,"The company has launched its Centre of Excellence for financial services in Buenos Aires, Argentina. It has onboarded 50 technology experts and plans to scale up to 200 by the end of the year.",Positive,Positive,0.244
POWERGRID,2025-06-06,"The company has commissioned the project—Transmission Network Expansion in Gujarat to increase ATC from ISTS, Part-C.",Positive,Negative,0.766
CEATLTD,2025-06-06,The Board will meet on June 10 to consider the issuance of non-convertible debentures worth up to Rs 500 crore on a private placement basis.,Positive,Positive,1.847
PIGL,2025-06-06,The company has received a third work order from Nyati Engineering & Construction. The contract pertains to the power supply system electrical work at the Udaipur Air Terminal in Rajasthan and is valued at Rs 6.25 crore.,Positive,Positive,0.622
NILASPACES,2025-06-06,"The company’s subsidiary, Nila Urban Living, has awarded the construction contract worth Rs 129.25 crore for its upcoming premium residential development at GIFT City to Riveria Infrastructures. The project is scheduled to be completed over 27 months from the date of commencement.",Negative,Positive,-1.251
TEJASNET,2025-06-06,"The company has received Rs 123 crore from the Department of Telecommunications under the Production Linked Incentive (PLI) Scheme for telecom and networking products. The said amount is the first tranche, amounting to 85 percent of the eligible incentive for Q3FY25. The remainder is expected to be released subsequently.",Neutral,Positive,-0.041
RSYSTEMS,2025-06-06,"The company has executed the sale deed to sell land and building at Noida, Uttar Pradesh, along with some assets, for Rs 50.5 crore.",Positive,Neutral,3.587
HILTON,2025-06-06,Promoter Yuvraj Hiralal Malhotra has sold a 0.56% stake (1.31 lakh shares) in the company.,Negative,Negative,-2.197
KHADIM,2025-06-06,Bandhan Mutual Fund has sold 1 lakh shares in Khadim India.,Positive,Negative,4.988
KHADIM,2025-06-06,Stock Trades Ex-Bonus,Positive,Negative,4.988
MEDIASSIST,2025-06-06,Stock Trades Ex-Date for Rights,Positive,Neutral,0.528
KAYNES,2025-08-05,"The company’s subsidiary, Kaynes Circuits India, has entered into a non-binding Memorandum of Understanding (MoU) with the Government of Tamil Nadu for an investment of Rs 4,995 crore over a period of six years. The investment will be used for the establishment of manufacturing facilities, including greenfield projects and capacity expansions within Tamil Nadu.",Negative,Positive,-0.706
PSPPROJECT,2025-08-05,"Adani Infra (India), owned by Gautam Adani’s Adani Enterprises, has acquired an additional 86.55 lakh shares (21.83% stake) in PSP Projects at Rs 640 per share, amounting to Rs 553.92 crore. However, promoter Prahaladbhai Shivrambhai Patel sold 91 lakh shares at Rs 640.01 per share on the BSE, and another 6 lakh shares at Rs 625 per share. This entire 24.47% stake is valued at Rs 619.9 crore.",Negative,Positive,-1.134
YATHARTH,2025-08-05,"PMS firm Purnartha Investment Advisers has bought 5.8 lakh shares (0.6% stake) at Rs 649.9 per share, amounting to Rs 37.6 crore.",Positive,Positive,4.247
NLCINDIA,2025-05-30,"The company’s subsidiary, NLC India Renewables, has signed a Joint Venture agreement with Mahatma Phule Renewable Energy & Infrastructure Technology (MAHAPREIT) to accelerate renewable energy development in Maharashtra. Under the agreement, they will develop 2,000 MW of renewable energy projects.",Negative,Positive,-0.731
HARSHA,2025-05-30,DSP Mutual Fund has acquired 4.64 lakh shares (representing a 0.5 percent stake) in the company at an average price of Rs 383 per share.,Positive,Positive,2.202
IFBAGRO,2025-05-30,"India Opportunities Growth Fund – Pinewood Strategy bought 50,000 shares (or 0.53 percent equity) at an average price of Rs 688.09 per share.",Positive,Negative,5.232
INDIGO,2025-05-30,"BNP Paribas Financial Markets acquired 46,000 equity shares in the airline company at an average price of Rs 5,246.35 per share, from Morgan Stanley Asia (Singapore) Pte.",Positive,Negative,0.452
MARUTI,2025-07-17,"The company has announced the standardization of six airbags in the Ertiga and Baleno. This will result in an average ex-showroom price increase of 1.4% for the Ertiga and 0.5% for the Baleno, effective July 16.",Negative,Neutral,-0.74
SBIN,2025-07-17,"The Board of Directors of the bank has approved the launch of a Qualified Institutional Placement (QIP) issuance on July 16, with the floor price set at Rs 811.05 per share. This floor price is lower than the closing price of Rs 831.55 per share on Wednesday.",Negative,Positive,-1.121
GODREJPROP,2025-07-17,"The real estate developer has announced its entry into Raipur through the acquisition of 50 acres of land. Development on this land will primarily consist of premium plotted residential units, offering an estimated saleable area of 9.5 lakh square feet.",Positive,Positive,1.213
HINDZINC,2025-07-17,"The Ministry of Mines has issued a Letter of Intent to Hindustan Zinc, naming it the preferred bidder for the grant of a composite license through the e-auction of the Jhandawali–Satipura Amalgamated Potash and Halite block in Rajasthan. The block covers an extent of 1,841.25 hectares in the Hanumangarh district.",Negative,Positive,-0.319
ZYDUSLIFE,2025-07-17,"The US Food and Drug Administration (USFDA) conducted a Remote Regulatory Assessment (RRA) at Zydus’ formulations manufacturing facility in Matoda, Gujarat, for the Prior Approval Supplement (PAS) of Atorvastatin Calcium Tablets USP (10 mg, 20 mg, 40 mg, and 80 mg). At closure, no observations were noted, and the site was recommended for approval.",Positive,Positive,0.743
EMCURE,2025-07-17,"Emcure has entered into an exclusive distribution and promotion agreement with Sanofi India for Sanofi’s oral anti-diabetic (OAD) drugs, including Amaryl and Cetapin, in India. The agreement is effective immediately.",Negative,Positive,-1.814
SMARTWORKS,2025-07-17,Stocks Trade Ex-Dividend,Positive,,
NCC,2025-03-26,"The company has received two advance work orders worth Rs 10,804.6 crore from Bharat Sanchar Nigam for the design, supply, construction, installation, upgradation, operation, and maintenance of the middle-mile network of BharatNet in Uttarakhand Telecom Circle and Madhya Pradesh, DNH, and DD telecom circles.",Negative,Positive,-3.832
WELENT,2025-03-26,"The company's subsidiary, Welspun Michigan Engineers, in joint venture with Aaradhyaa & Co, has secured a new order worth Rs 328.12 crore from Brihanmumbai Municipal Corporation (BMC) for the upgradation of the Haji Ali Storm Water Pumping Station in Mumbai, Maharashtra, followed by 15 years of operations and maintenance.",Negative,Positive,-4.552
WAAREERTL,2025-03-26,"The company has received a Letter of Award (LOA) for a project worth Rs 232.3 crore. The project involves the execution of engineering, procurement, and construction (EPC) works for a ground-mounted solar power project, including operation and maintenance of a 170 MW AC/255 MW DC capacity on a turnkey basis.",Negative,,
FEDERALBNK,2025-03-26,"The Board approved the execution of a binding Memorandum of Understanding with Ageas Insurance International NV (Ageas) and Ageas Federal Life Insurance Company (AFLIC) for the acquisition of a 4% equity stake by the bank in AFLIC, from Ageas. Post-acquisition of the 4% stake, the bank's stake in AFLIC will increase to 30% from 26%.",Negative,Negative,-0.922
MARUTI,2025-03-26,"The automobile company has received a draft assessment order for FY22 from the Income Tax Authority, wherein certain additions/disallowances amounting to Rs 2,966 crore with respect to the returned income (disclosed by the company in its income tax return) have been proposed.",Negative,Negative,-0.616
PRSMJOHNSN,2025-03-26,"The Madhya Pradesh government has declared the company as the preferred bidder for the mining lease of the Jamodi Mahanna Sector I (Part B) limestone block with an area of 416.73 hectares, and the Jamodi Mahanna Sector II (Part B) limestone block with an area of 264.156 hectares.",Negative,Positive,-2.23
MINDACORP,2025-03-26,The Board will meet on March 28 to consider raising funds via the issue of one or more instruments/securities.,Negative,Positive,-0.979
ONGC,2025-03-26,"The company will make an investment of Rs 3,300 crore in subsidiary ONGC Green via rights issue. The subsidiary will utilize the proceeds for the acquisition of a 100% equity stake in Ayana Renewable Power through ONGC NTPC Green (ONGPL). ONGPL is a 50:50 joint venture company of ONGC Green and NTPC Green Energy. The company's subsidiary ONGC Videsh will invest up to Rs 1,500 crore in Beas Rovuma Energy Mozambique. Beas Rovuma Energy Mozambique is a subsidiary of ONGC Videsh with 60% shareholding, and the other joint venture partner is Oil India.",Negative,Positive,-1.492
TVSMOTOR,2025-03-26,"The company's subsidiary, TVS Motor (Singapore) Pte, has agreed to acquire an additional 8.26% stake in GO Corporation, Switzerland, from its existing shareholder for CHF 500,000.",Positive,Negative,0.588
IOB,2025-03-26,"The bank has received an income tax demand order worth Rs 558.96 crore for AY 2023-24. The bank is in the process of filing an appeal before the appropriate forum within prescribed timelines. The order will have no impact on the financials, operations, or other activities of the bank.",Neutral,Negative,0.024
JYOTHYLAB,2025-03-26,"The company has executed a Share Purchase Agreement (SPA) with Kallol Enterprise for the sale of its entire 75% equity stake in Jyothy Kallol Bangladesh (JKBL) to Kallol Enterprise, for Bangladeshi Taka 3,01,92,134. Accordingly, JKBL has ceased to be a subsidiary of the company.",Negative,Neutral,-2.241
BHEL,2025-03-26,"BHEL has extended its Technology Collaboration Agreement (TCA) with Vogt Power International Inc., USA, for heat recovery steam generators.",Negative,Positive,-1.924
INDGN,2025-03-26,"The company's subsidiary, Indegene Ireland, with the intention to expand its business, has agreed to acquire, in a phased manner, MJL Communications Group and its subsidiary MJL Advertising on a debt-free, cash-free basis for GBP 3.4 million.",Negative,Positive,-4.042
